{
  "id": "global",
  "kind": "global",
  "title": "True North ProductWiki",
  "document": "global/README.md",
  "positioning": "个人成长与生活管理工具套件的全局产品规范。",
  "entities": [
    {
      "id": "user",
      "name": "用户",
      "fields": [
        {
          "id": "role",
          "name": "角色",
          "type": "enum",
          "required": true,
          "values": [
            "个人用户",
            "高级用户",
            "管理员"
          ],
          "description": "决定可用的产品能力与限制。",
          "productStatus": "roadmap",
          "prototypeCoverage": "complete"
        }
      ],
      "productStatus": "roadmap",
      "prototypeCoverage": "complete"
    }
  ],
  "rules": [
    {
      "id": "global.relationships",
      "name": "成长实体关联",
      "entities": [
        "goal",
        "task",
        "todo",
        "habit"
      ],
      "description": "Goal、Task、Todo 和 Habit 构成从规划到执行的关联链路。",
      "reference": "global.rules",
      "productStatus": "roadmap",
      "prototypeCoverage": "partial"
    }
  ],
  "references": [
    {
      "id": "global.overview",
      "heading": "## 产品定位"
    },
    {
      "id": "global.architecture",
      "heading": "## 产品能力边界"
    },
    {
      "id": "global.rules",
      "heading": "## 全局业务规则"
    }
  ],
  "productStatus": "roadmap",
  "prototypeCoverage": "complete"
}
